{
  "schema_version": "boss-release/0.1-candidate",
  "run_id": "FIXTURE-002",
  "system_id": "boss-fixture",
  "input": {
    "state": "UNKNOWN",
    "evidence_refs": []
  },
  "process": {
    "state": "OBSERVED",
    "evidence_refs": [
      "fixture://evidence/process"
    ]
  },
  "output": {
    "state": "OBSERVED",
    "evidence_refs": [
      "fixture://evidence/output"
    ]
  },
  "storage": {
    "state": "OBSERVED",
    "evidence_refs": [
      "fixture://evidence/storage"
    ]
  },
  "risk": {
    "tier": "T1",
    "reviewer": "fixture-human",
    "assessment_ref": "fixture://risk/assessment"
  },
  "controls": {
    "privacy": {
      "status": "PASS",
      "evidence_refs": [
        "fixture://control/privacy"
      ]
    },
    "evidence": {
      "status": "PASS",
      "evidence_refs": [
        "fixture://control/evidence"
      ]
    },
    "specialist_referral": {
      "status": "PASS",
      "evidence_refs": [
        "fixture://control/specialist_referral"
      ]
    },
    "incident_route": {
      "status": "PASS",
      "evidence_refs": [
        "fixture://control/incident_route"
      ]
    }
  },
  "authorization": {
    "human_approver": "fixture-human",
    "approval_ref": "fixture://auth/approved"
  },
  "disposition": "APPROVED"
}
